{
  "@type": [
    "ada:collection",
    "https://schema.org/Collection"
  ],
  "ada:componentType": {
    "@type": "ada:SEMEDSElementalMaps"
  },
  "ada:memberTypes": [
    "ada:SEMEDSElementalMap"
  ],
  "ada:nFiles": 5,
  "ada:filelist": [
    {
      "ada:fileName": "map_Fe_Ka.tif",
      "ada:componentType": "ada:SEMEDSElementalMap",
      "schema:encodingFormat": "image/tiff"
    },
    {
      "ada:fileName": "map_Si_Ka.tif",
      "ada:componentType": "ada:SEMEDSElementalMap",
      "schema:encodingFormat": "image/tiff"
    }
  ]
}